001:087:002:DESCRIPTOR         1775344884.789193
 06 00 FF 09 01 A1 01 15 00 26 FF 00 09 00 A1 02
 85 FF 09 20 75 08 95 3F 81 02 C0 09 01 A1 02 85
 01 09 21 75 08 95 3F B1 02 C0 09 02 A1 02 85 08
 09 22 75 08 95 10 B1 02 C0 09 03 A1 02 85 09 09
 23 75 08 95 3F B1 02 C0 09 05 A1 02 85 0B 09 25
 75 08 95 3F B1 02 C0 C0

001:087:000:DESCRIPTOR         1775344884.804199
 05 01 09 04 A1 01 09 01 A1 00 09 30 09 31 15 00
 27 FF FF 00 00 75 10 95 02 81 02 09 35 15 00 26
 FF 0F 75 0C 95 01 81 02 05 01 09 39 15 01 25 08
 35 00 46 3B 01 66 14 00 75 04 95 01 81 42 05 09
 19 01 29 11 15 00 25 01 95 11 75 01 81 02 75 07
 95 01 81 01 05 01 09 33 09 34 15 00 26 FF 00 75
 08 95 02 81 02 C0 C0

